{
  "candidate_id": "CAN-88421",
  "personal_info": {
    "full_name": "Rahul Sharma",
    "email": "rahul.sharma@email.com",
    "phone": "+91-98765-43210",
    "location": "Bangalore, India",
    "linkedin_url": "https://linkedin.com/in/rahulsharma-dev"
  },
  "summary": "Software engineer with 4.5 years of experience building backend services and cloud-native applications on Azure. Strong Python and Kubernetes skills with proven track record of performance optimization.",
  "experience": [
    {
      "company": "Infosys Limited",
      "title": "Senior Software Engineer",
      "start_date": "2022-01-15",
      "end_date": null,
      "is_current": true,
      "description": "Designed REST microservices in Python serving 2M daily requests. Deployed services on Azure AKS with Docker/Kubernetes. Reduced API latency 35% via query optimization and Redis caching.",
      "skills_used": [
        "Python",
        "REST",
        "Docker",
        "Kubernetes",
        "Azure",
        "PostgreSQL",
        "Redis"
      ]
    },
    {
      "company": "Tata Consultancy Services",
      "title": "Software Engineer",
      "start_date": "2020-06-01",
      "end_date": "2021-12-31",
      "is_current": false,
      "description": "Built CI/CD pipelines using Azure DevOps. Developed SQL reporting modules for enterprise banking clients.",
      "skills_used": [
        "Python",
        "Azure DevOps",
        "SQL",
        "Java"
      ]
    }
  ],
  "education": [
    {
      "institution": "Visvesvaraya Technological University",
      "degree": "B.Tech",
      "field_of_study": "Computer Science",
      "graduation_date": "2020-05-15",
      "gpa": "8.4/10"
    }
  ],
  "skills": [
    "Python",
    "Java",
    "REST APIs",
    "Docker",
    "Kubernetes",
    "Azure",
    "PostgreSQL",
    "Git",
    "CI/CD",
    "Microservices"
  ],
  "certifications": [
    "AZ-900: Azure Fundamentals",
    "CKA: Certified Kubernetes Administrator"
  ],
  "extraction_metadata": {
    "confidence_aggregate": 0.94,
    "prompt_version": "1.0.0",
    "extracted_at": "2026-08-03T09:18:42Z"
  }
}